{"$id":"https://outerheavenx.github.io/citadel-of-vesper/schemas/accessory.schema.json","$schema":"https://json-schema.org/draft/2020-12/schema","additionalProperties":false,"description":"Accessory definition (accessory1/accessory2 slots).","properties":{"category":{"const":"accessory"},"comboWith":{"description":"Item ids this accessory combos with (spec §21 accessory combinations).","items":{"type":"string"},"type":"array"},"description":{"type":"string"},"flavor":{"type":"string"},"icon":{"type":"string"},"id":{"pattern":"^[a-z0-9_]+$","type":"string"},"name":{"type":"string"},"rarity":{"enum":["common","uncommon","rare","epic","legendary"]},"slot":{"enum":["accessory1","accessory2"]},"special":{"description":"Non-stat effect id, implemented by later waves.","type":"string"},"stats":{"additionalProperties":{"type":"number"},"type":"object"},"value":{"minimum":0,"type":"integer"}},"required":["id","name","category","description","rarity","value","icon","stats"],"title":"Accessory","type":"object"}