[{"category":"accessory","comboWith":["moonsteel_sabre"],"description":"A pale stone that drinks moonlight and gives it back as warmth.","flavor":"It was his sister's. He does not talk about it.","icon":"moonstone_charm","id":"moonstone_charm","name":"Moonstone Charm","rarity":"rare","special":"moonlit_empower","stats":{"lck":3,"mdef":5},"value":300},{"category":"accessory","description":"A signet ring of a disgraced house. Its weight steadies the hand.","icon":"iron_signet","id":"iron_signet","name":"Iron Signet","rarity":"common","stats":{"crit":2,"str":1},"value":60}]